id,name,brand,category,description,color,price
1,Air Max 270,Nike,Lifestyle,"Air Max model idealan za svaki dan. Udoban i moderan dizajn.",Crna,120
2,Air Jordan 1,Nike,Basketball,"Čuvena Jordan serija. Retro izgled i vrhunske performanse.",Bela,150
3,Ultra Boost,Adidas,Running,"Maksimalna udobnost prilikom trčanja i svakodnevnog nošenja.",Siva,130
4,Stan Smith,Adidas,Lifestyle,"Klasični minimalizam uz kožni gornji deo i udoban đon.",Bela,90
5,RS-X,Puma,Lifestyle,"Retro-futuristički dizajn, kombinacija više materijala i boja.",Crna,100
6,Suede Classic,Puma,Lifestyle,"Legendarni model, prepoznatljiv po gornjištu od antilopa.",Plava,80
